{
  "sample_id": "ATOM-NLRB-INJUNCTION-GENERAL-2024",
  "schema_version": "0.1",
  "split": "holdout",
  "collection_status": "collected",
  "source": {
    "source_id": "nlrb-wave4",
    "source_type": "government",
    "publisher": "National Labor Relations Board",
    "source_name": "General labor injunction policy",
    "source_authority": "primary_organization",
    "source_reliability": "high",
    "source_locator": "https://www.nlrb.gov/news-outreach/news-story/nlrb-general-counsel-reaffirms-commitment-to-seeking-injunctions-to",
    "language": "en",
    "content_type": "text/html",
    "retrieved_at": "2026-09-09T13:58:58Z",
    "published_at": "2024-07-16T00:00:00Z",
    "raw_ref": "raw/registry-wave3/ATOM-NLRB-INJUNCTION-GENERAL-2024.html",
    "content_hash": "c76db6d095f0c8b4783f82b5fdde0c6ab7018e1a4fd50718d5e898e4125c2f0e",
    "hash_method": "sha256",
    "license": "U.S. Government work / public domain",
    "access_constraints": "Public direct agency page"
  },
  "labels": {
    "primary_class": "irrelevant",
    "primary_label": "registry_provisional",
    "event_category": "labor_infrastructure_transportation",
    "event_type": "labor_policy_control",
    "event_subtype": "nlrb-wave4",
    "expected_relevance_class": "irrelevant",
    "expected_disposition": "suppress",
    "tasks": [
      "relevance",
      "event_extraction",
      "grounding"
    ]
  },
  "provenance": {
    "collection_plan_id": "RSIB-registry-wave3",
    "collector_id": "rock-supply-intelligence",
    "collector_version": "registry-collector/1.0.0",
    "ingestion_method": "registry_direct_https_get",
    "pipeline_run_id": "RSIB-registry-wave3-2026-09-09T13:58:58Z",
    "transformations": [],
    "ai_used": false,
    "synthetic": false,
    "content_status": "lawful_capture",
    "adjudication_status": "reviewed",
    "notes": "Registry-selected direct primary source; provisional label requires human review. Human review HR-W4-20260909-03: keep."
  }
}
