{
  "sample_id": "ATOM-CWA-TDB-202408",
  "schema_version": "0.1",
  "split": "holdout",
  "collection_status": "collected",
  "source": {
    "source_id": "CWA-TDB-202408",
    "source_type": "government",
    "publisher": "Central Weather Administration, Taiwan",
    "source_name": "Typhoon Database record 202408",
    "source_authority": "official_government",
    "source_reliability": "high",
    "source_locator": "https://rdc28.cwa.gov.tw/TDB/public/typhoon_detail?typhoon_id=202408",
    "language": "zh-TW",
    "content_type": "text/html",
    "retrieved_at": "2026-09-08T03:14:34Z",
    "published_at": null,
    "license": "not stated on retained page",
    "access_constraints": "public web page",
    "raw_ref": "raw/wave2/ATOM-CWA-TDB-202408.html",
    "content_hash": "e71e344bd34094a32e80b3493a2e0559eec2ac7263559d301c9166da0362f16e",
    "hash_method": "sha256"
  },
  "labels": {
    "primary_class": "monitor",
    "primary_label": "taiwan_cwa_typhoon_review_queue",
    "event_category": "weather_natural_disaster",
    "event_type": "tropical_cyclone",
    "event_subtype": "CWA_typhoon_database",
    "expected_relevance_class": "monitor",
    "expected_disposition": "monitor",
    "tasks": [
      "relevance",
      "event_extraction",
      "grounding"
    ]
  },
  "provenance": {
    "collection_plan_id": "RSIB-v0.1-wave2",
    "collector_id": "rock-supply-intelligence",
    "collector_version": "osint-fixture-ingest/0.2.0",
    "ingestion_method": "direct_https_get",
    "pipeline_run_id": "RSIB-v0.1-wave2-2026-09-08T03:14:34Z",
    "transformations": [],
    "ai_used": false,
    "synthetic": false,
    "content_status": "lawful_capture",
    "adjudication_status": "reviewed",
    "notes": "Official CWA record retained for review; Taiwan supply-chain impact is not presumed. Human review W14-22: keep."
  }
}
