{
  "sample_id": "ATOM-NOAA-BERYL-03",
  "schema_version": "0.1",
  "split": "selection",
  "collection_status": "collected",
  "source": {
    "source_id": "NHC-AL022024-ADV003",
    "source_type": "government",
    "publisher": "NOAA National Hurricane Center",
    "source_name": "Hurricane Beryl public advisory #3",
    "source_authority": "official_government",
    "source_reliability": "high",
    "source_locator": "https://www.nhc.noaa.gov/archive/2024/al02/al022024.public.003.shtml",
    "language": "en",
    "content_type": "text/html",
    "retrieved_at": "2026-09-08T04:20:40Z",
    "published_at": null,
    "license": "U.S. Government work / public domain",
    "access_constraints": "public NHC archive",
    "raw_ref": "raw/wave2/ATOM-NOAA-BERYL-03.html",
    "content_hash": "35f525af42ab4acad48a5970646b7002f420e46f0d1d7be7ab728fe90c31cbf1",
    "hash_method": "sha256"
  },
  "labels": {
    "primary_class": "irrelevant",
    "primary_label": "nhc_hurricane_beryl_negative_control",
    "event_category": "irrelevant_general_world",
    "event_type": "tropical_cyclone",
    "event_subtype": "NHC_public_advisory",
    "expected_relevance_class": "irrelevant",
    "expected_disposition": "suppress",
    "tasks": [
      "relevance",
      "event_extraction",
      "grounding"
    ]
  },
  "provenance": {
    "collection_plan_id": "RSIB-v0.1-wave2",
    "collector_id": "rock-supply-intelligence",
    "collector_version": "osint-fixture-ingest/0.2.0",
    "ingestion_method": "direct_https_get",
    "pipeline_run_id": "RSIB-v0.1-wave2-2026-09-08T04:20:40Z",
    "transformations": [],
    "ai_used": false,
    "synthetic": false,
    "content_status": "lawful_capture",
    "adjudication_status": "reviewed",
    "notes": "Dated NHC archive advisory retained as a Taiwan-route negative control. Provisional label requires review. Human review W14-29: keep."
  }
}
