{
  "sample_id": "ATOM-SYN-AMB-MIXED-027",
  "schema_version": "0.1",
  "split": "selection",
  "collection_status": "collected",
  "source": {
    "source_id": "ATOM-SYN-AMB-MIXED-027",
    "source_type": "analyst",
    "publisher": "Rock Supply Intelligence benchmark authors",
    "source_name": "Synthetic quota fixture",
    "source_authority": "none",
    "source_reliability": "not_applicable",
    "source_locator": "synthetic://ATOM-SYN-AMB-MIXED-027",
    "language": "mixed",
    "content_type": "text/plain",
    "retrieved_at": "2026-09-07T21:35:01Z",
    "published_at": "2026-09-07T21:35:01Z",
    "raw_ref": "raw/synthetic-quota/ATOM-SYN-AMB-MIXED-027.txt",
    "content_hash": "7291d6bec5fe70cb0da913554b6d58ca5ea54d963b78303da26cafa27a2ca8de",
    "hash_method": "sha256",
    "license": "benchmark-internal synthetic fixture",
    "access_constraints": "synthetic; not a real-world source"
  },
  "labels": {
    "primary_class": "ambiguous_conflicting",
    "primary_label": "synthetic_quota",
    "event_category": "port_vessel_carrier",
    "event_type": "other",
    "event_subtype": "ambiguous_conflicting",
    "expected_relevance_class": "ambiguous_conflicting",
    "expected_disposition": "abstain",
    "tasks": [
      "relevance",
      "grounding"
    ]
  },
  "provenance": {
    "collection_plan_id": "RSIB-v0.1-synthetic-quota",
    "collector_id": "rock-supply-intelligence",
    "collector_version": "synthetic-quota/0.1.0",
    "ingestion_method": "authored_synthetic",
    "transformations": [],
    "ai_used": false,
    "synthetic": true,
    "content_status": "lawful_capture",
    "adjudication_status": "reviewed",
    "notes": "Authored synthetic fixture to fill specified adversarial/ambiguity quotas. Human review W12-21: keep."
  }
}
