{
  "sample_id": "ATOM-NOAA-BERYL-30",
  "schema_version": "0.1",
  "split": "dev",
  "collection_status": "collected",
  "source": {
    "source_id": "NHC-AL022024-ADV030",
    "source_type": "government",
    "publisher": "NOAA National Hurricane Center",
    "source_name": "Hurricane Beryl public advisory #30",
    "source_authority": "official_government",
    "source_reliability": "high",
    "source_locator": "https://www.nhc.noaa.gov/archive/2024/al02/al022024.public.030.shtml",
    "language": "en",
    "content_type": "text/html",
    "retrieved_at": "2026-09-08T03:06:41Z",
    "published_at": null,
    "license": "U.S. Government work / public domain",
    "access_constraints": "public NHC archive",
    "raw_ref": "raw/wave2/ATOM-NOAA-BERYL-30.html",
    "content_hash": "a47307b5cfda0664b01ddc632632c65efa2db66f2ab566233e3293d9e1f033dc",
    "hash_method": "sha256"
  },
  "labels": {
    "primary_class": "irrelevant",
    "primary_label": "nhc_hurricane_beryl_archive",
    "event_category": "weather_natural_disaster",
    "event_type": "tropical_cyclone",
    "event_subtype": "NHC_public_advisory",
    "expected_relevance_class": "irrelevant",
    "expected_disposition": "suppress",
    "tasks": [
      "relevance",
      "event_extraction",
      "grounding"
    ]
  },
  "provenance": {
    "collection_plan_id": "RSIB-v0.1-wave2",
    "collector_id": "rock-supply-intelligence",
    "collector_version": "osint-fixture-ingest/0.2.0",
    "ingestion_method": "direct_https_get",
    "pipeline_run_id": "RSIB-v0.1-wave2-2026-09-08T03:06:41Z",
    "transformations": [],
    "ai_used": false,
    "synthetic": false,
    "content_status": "lawful_capture",
    "adjudication_status": "reviewed",
    "notes": "Dated NHC archive advisory. Provisional routing classification; requires label review. Human review W14-45: keep."
  }
}
