{
  "sample_id": "ATOM-W11-MPB-LIVE-FIRING-DEC2025",
  "schema_version": "0.1",
  "split": "selection",
  "collection_status": "collected",
  "source": {
    "source_id": "taiwan-maritime-mixed-wave11",
    "source_type": "government",
    "publisher": "Taiwan Maritime and Port Bureau",
    "source_name": "Taiwan waters live-firing exercise navigation restriction",
    "source_authority": "primary_organization",
    "source_reliability": "high",
    "source_locator": "https://www.motcmpb.gov.tw/En/Information/Detail/b1079730-181b-489a-af8f-4d23e115f00b?NodeId=10016&SiteId=2",
    "language": "mixed",
    "content_type": "text/html",
    "retrieved_at": "2026-09-09T21:42:19Z",
    "published_at": "2025-11-28T00:00:00Z",
    "raw_ref": "raw/registry-wave3/ATOM-W11-MPB-LIVE-FIRING-DEC2025.html",
    "content_hash": "cfcd8b7f2a13e7531e75f538a40f569c21cea6b856d5e8d164bbd41db513e5a7",
    "hash_method": "sha256",
    "license": "Public government publication",
    "access_constraints": "Public direct bilingual notice or notice PDF"
  },
  "labels": {
    "primary_class": "materially_relevant",
    "primary_label": "registry_provisional",
    "event_category": "geopolitical_security",
    "event_type": "military_navigation_restriction",
    "event_subtype": "taiwan-maritime-mixed-wave11",
    "expected_relevance_class": "materially_relevant",
    "expected_disposition": "normalize",
    "tasks": [
      "relevance",
      "event_extraction",
      "grounding"
    ]
  },
  "provenance": {
    "collection_plan_id": "RSIB-registry-wave3",
    "collector_id": "rock-supply-intelligence",
    "collector_version": "registry-collector/1.0.0",
    "ingestion_method": "registry_direct_https_get",
    "pipeline_run_id": "RSIB-registry-wave3-2026-09-09T21:42:19Z",
    "transformations": [],
    "ai_used": false,
    "synthetic": false,
    "content_status": "lawful_capture",
    "adjudication_status": "reviewed",
    "notes": "Registry-selected direct primary source; provisional label requires human review. Human review W11-20: keep."
  }
}
