{
  "sample_id": "ATOM-FR-TARIFF-PAGE-07",
  "schema_version": "0.1",
  "split": "dev",
  "collection_status": "collected",
  "source": {
    "source_id": "FR-TARIFF-SEARCH-07",
    "source_type": "government",
    "publisher": "Office of the Federal Register",
    "source_name": "Federal Register tariff search results page 7",
    "source_authority": "official_government",
    "source_reliability": "high",
    "source_locator": "https://www.federalregister.gov/api/v1/documents.json?conditions%5Bterm%5D=tariff&order=newest&per_page=20&page=7",
    "language": "en",
    "content_type": "application/json",
    "retrieved_at": "2026-09-08T03:06:41Z",
    "published_at": null,
    "license": "U.S. Government work / public domain",
    "access_constraints": "public Federal Register API",
    "raw_ref": "raw/wave2/ATOM-FR-TARIFF-PAGE-07.json",
    "content_hash": "f66204dddf942a5d7878341434497f163beb9bfa24a5db6222888be79e72b3f0",
    "hash_method": "sha256"
  },
  "labels": {
    "primary_class": "monitor",
    "primary_label": "federal_register_tariff_search",
    "event_category": "regulatory_trade_customs",
    "event_type": "customs_regulatory",
    "event_subtype": "federal_register_search_page",
    "expected_relevance_class": "monitor",
    "expected_disposition": "monitor",
    "tasks": [
      "relevance",
      "event_extraction",
      "grounding"
    ]
  },
  "provenance": {
    "collection_plan_id": "RSIB-v0.1-wave2",
    "collector_id": "rock-supply-intelligence",
    "collector_version": "osint-fixture-ingest/0.2.0",
    "ingestion_method": "direct_https_get",
    "pipeline_run_id": "RSIB-v0.1-wave2-2026-09-08T03:06:41Z",
    "transformations": [],
    "ai_used": false,
    "synthetic": false,
    "content_status": "lawful_capture",
    "adjudication_status": "reviewed",
    "notes": "Official tariff-search payload. Individual result relevance is not presumed; review required. Human review W15-07: keep."
  }
}
