{
  "sample_id": "ATOM-USGS-01",
  "schema_version": "0.1",
  "split": "dev",
  "collection_status": "collected",
  "source": {
    "source_id": "USGS-us7000m9g4",
    "source_type": "authoritative_feed",
    "publisher": "U.S. Geological Survey",
    "source_name": "M 7.4 - 15 km S of Hualien City, Taiwan",
    "source_authority": "official_government",
    "source_reliability": "high",
    "source_locator": "https://earthquake.usgs.gov/fdsnws/event/1/query?format=geojson&eventid=us7000m9g4",
    "language": "en",
    "content_type": "application/geo+json",
    "retrieved_at": "2026-09-07T19:47:30Z",
    "published_at": "2024-04-02T23:58:12Z",
    "effective_at": "2024-04-02T23:58:12Z",
    "observed_at": "2026-06-25T10:54:32Z",
    "raw_ref": "raw/first20/ATOM-USGS-01.json",
    "content_hash": "1dd4e8f91179e0cef3e2b359151693ba400754fe5a9bd9a743a255cc9a1ac780",
    "hash_method": "sha256",
    "license": "U.S. Government work / public domain",
    "access_constraints": "public API"
  },
  "labels": {
    "primary_class": "materially_relevant",
    "primary_label": "taiwan_major_earthquake",
    "event_category": "weather_natural_disaster",
    "event_type": "earthquake",
    "event_subtype": "M7_plus_mainshock",
    "expected_relevance_class": "materially_relevant",
    "expected_disposition": "normalize",
    "tasks": [
      "event_extraction",
      "supply_chain_impact_assessment"
    ]
  },
  "provenance": {
    "collection_plan_id": "RSIB-v0.1-first20",
    "collector_id": "rock-ai-solutions",
    "collector_version": "osint-fixture-ingest/0.1.0",
    "ingestion_method": "direct_https_get",
    "pipeline_run_id": "RSIB-v0.1-first20-20260907T194730Z",
    "transformations": [],
    "ai_used": false,
    "synthetic": false,
    "content_status": "lawful_capture",
    "notes": "Event, source-update, magnitude, and place are retained in the USGS GeoJSON payload. Human review W13-01: keep.",
    "adjudication_status": "reviewed"
  }
}
