{
  "sample_id": "ATOM-TWMOL-BOOKSELLER-DISPUTE-2022",
  "schema_version": "0.1",
  "split": "selection",
  "collection_status": "collected",
  "source": {
    "source_id": "taiwan-labor-wave7",
    "source_type": "government",
    "publisher": "Taiwan Ministry of Labor",
    "source_name": "Book retailer employment-status dispute control",
    "source_authority": "primary_organization",
    "source_reliability": "high",
    "source_locator": "https://www.mol.gov.tw/1607/1632/1640/57145/post",
    "language": "zh-TW",
    "content_type": "text/html",
    "retrieved_at": "2026-09-09T15:47:38Z",
    "published_at": "2022-12-24T00:00:00Z",
    "raw_ref": "raw/registry-wave3/ATOM-TWMOL-BOOKSELLER-DISPUTE-2022.html",
    "content_hash": "aadaa554660ae50dd40c6497c7c454d82d3abbe86e5f38350ae3b76d67b5ff53",
    "hash_method": "sha256",
    "license": "Public government publication",
    "access_constraints": "Public direct government release"
  },
  "labels": {
    "primary_class": "irrelevant",
    "primary_label": "registry_provisional",
    "event_category": "labor_infrastructure_transportation",
    "event_type": "labor_non_supply_chain_control",
    "event_subtype": "taiwan-labor-wave7",
    "expected_relevance_class": "irrelevant",
    "expected_disposition": "suppress",
    "tasks": [
      "relevance",
      "event_extraction",
      "grounding"
    ]
  },
  "provenance": {
    "collection_plan_id": "RSIB-registry-wave3",
    "collector_id": "rock-supply-intelligence",
    "collector_version": "registry-collector/1.0.0",
    "ingestion_method": "registry_direct_https_get",
    "pipeline_run_id": "RSIB-registry-wave3-2026-09-09T15:47:38Z",
    "transformations": [],
    "ai_used": false,
    "synthetic": false,
    "content_status": "lawful_capture",
    "adjudication_status": "reviewed",
    "notes": "Registry-selected direct primary source; provisional label requires human review. Human review W7-04: keep."
  }
}
