{
  "sample_id": "ATOM-NLRB-HAMPTON-CASE-2024",
  "schema_version": "0.1",
  "split": "holdout",
  "collection_status": "collected",
  "source": {
    "source_id": "nlrb-wave4",
    "source_type": "government",
    "publisher": "National Labor Relations Board",
    "source_name": "Closed Hampton Roads ILA representation case",
    "source_authority": "primary_organization",
    "source_reliability": "high",
    "source_locator": "https://www.nlrb.gov/case/05-CB-347064",
    "language": "en",
    "content_type": "text/html",
    "retrieved_at": "2026-09-09T13:58:55Z",
    "published_at": "2024-08-05T00:00:00Z",
    "raw_ref": "raw/registry-wave3/ATOM-NLRB-HAMPTON-CASE-2024.html",
    "content_hash": "adb213e6053cc71ba4ba5fda2f4515e3151cccac543f7314073c2401d54ad93f",
    "hash_method": "sha256",
    "license": "U.S. Government work / public domain",
    "access_constraints": "Public direct agency page"
  },
  "labels": {
    "primary_class": "irrelevant",
    "primary_label": "registry_provisional",
    "event_category": "labor_infrastructure_transportation",
    "event_type": "administrative_case_control",
    "event_subtype": "nlrb-wave4",
    "expected_relevance_class": "irrelevant",
    "expected_disposition": "suppress",
    "tasks": [
      "relevance",
      "event_extraction",
      "grounding"
    ]
  },
  "provenance": {
    "collection_plan_id": "RSIB-registry-wave3",
    "collector_id": "rock-supply-intelligence",
    "collector_version": "registry-collector/1.0.0",
    "ingestion_method": "registry_direct_https_get",
    "pipeline_run_id": "RSIB-registry-wave3-2026-09-09T13:58:55Z",
    "transformations": [],
    "ai_used": false,
    "synthetic": false,
    "content_status": "lawful_capture",
    "adjudication_status": "reviewed",
    "notes": "Registry-selected direct primary source; provisional label requires human review. Human review HR-W4-20260909-02: keep."
  }
}
